city_id,district_id,name_en,name_si,name_ta,sub_name_en,sub_name_si,sub_name_ta,postcode,latitude,longitude
1,1,Akkaraipattu,අක්කරපත්තුව,அக்கரைப்பற்று, NULL, NULL, NULL,32400,7.2184279,81.8541161
2,1,Ambagahawatta,අඹගහවත්ත,அம்பகஹவத்த, NULL, NULL, NULL,90326,7.3017563,81.6747295
3,1,Ampara,අම්පාර,அம்பாறை, NULL, NULL, NULL,32000,7.3017563,81.6747295
4,1,Bakmitiyawa,බක්මිටියාව,பக்மிடியாவ, NULL, NULL, NULL,32024,7.0296318,81.6802054
5,1,Deegawapiya,දීඝවාපිය,தீகவாபி, NULL, NULL, NULL,32006,7.3017563,81.6747295
6,1,Devalahinda,දෙවලහිඳ,தேவாலஹிந்தா, NULL, NULL, NULL,32038,7.3017563,81.6747295
7,1,Digamadulla Weeragoda,දිගාමඩුල්ල වීරගොඩ,திகாமடுள்ள வீரகொட, NULL, NULL, NULL,32008,7.3901254,81.6965876
8,1,Dorakumbura,දොරකුඹුර,டோரகும்புரா, NULL, NULL, NULL,32104,7.3588697,81.3014284
9,1,Gonagolla,ගොනගොල්ල,கோனாகொல்லா, NULL, NULL, NULL,32064,7.4303735,81.5589252
10,1,Hulannuge,හුලංනුගේ,ஹுலனுகே, NULL, NULL, NULL,32514,6.9284717,81.6546714
11,1,Kalmunai,කල්මුණේ,கல்முனை, NULL, NULL, NULL,32300,7.3956781,81.8333656
12,1,Kannakipuram,කන්නකිපුරම්,கண்ணகிபுரம், NULL, NULL, NULL,32405,7.4935021,81.7957888
13,1,Karativu,කරතිව්,காரைதீவு, NULL, NULL, NULL,32250,7.3770282,81.8415065
14,1,Kekirihena,කැකිරිහේන,கெகிரிஹேன, NULL, NULL, NULL,32074,7.5074545,81.3351284
15,1,Koknahara,කොක්නහර,கோக்னஹாரா, NULL, NULL, NULL,32035,7.2239081,81.5623474
16,1,Kolamanthalawa,කෝලමන්තලාව,கொலமந்தலாவ, NULL, NULL, NULL,32102,7.2942916,81.2794123
17,1,Komari,කෝමාරි,கோமாரி, NULL, NULL, NULL,32418,6.9862603,81.8647787
18,1,Lahugala,ලාහුගල,லாஹுகல, NULL, NULL, NULL,32512,6.8720872,81.7226298
19,1,Irakkamam,ඉරක්කමම්,இறக்காமம், NULL, NULL, NULL,32450,7.2442442,81.7458845
20,1,Mahaoya,මහඔය,மகா ஓயா, NULL, NULL, NULL,32070,7.531216,81.3560952
21,1,Marathamune,මාරත්මුනේ,மருதமுனை, NULL, NULL, NULL,32314,7.3017563,81.6747295
22,1,Namaloya,නාමල්ඔය,நாமல் ஓய, NULL, NULL, NULL,32037,7.3311927,81.5322149
23,1,Navithanveli,නාවිදන්වෙලි,நாவிதன்வெளி, NULL, NULL, NULL,32308,7.4257726,81.7745699
24,1,Nintavur,නින්දවූර්,நிந்தவூர், NULL, NULL, NULL,32340,7.321168,81.8578523
25,1,Oluvil,ඔළුවිල,ஒலுவில், NULL, NULL, NULL,32360,7.2944473,81.8606821
26,1,Padiyatalawa,පදියතලාව,பதியதலாவ, NULL, NULL, NULL,32100,7.3925126,81.2436227
27,1,Pahalalanda,පහලලන්ද,பஹலாலண்ட, NULL, NULL, NULL,32034,7.2226881,81.5898016
28,1,Panama,පානම,பாணம, NULL, NULL, NULL,32508,6.7580589,81.8087721
29,1,Pannalagama,පන්නලගම,பன்னலகம, NULL, NULL, NULL,32022,7.3017563,81.6747295
30,1,Paragahakele,පරගහකැලේ,பரகஹகலே, NULL, NULL, NULL,32031,7.2577705,81.6089873
31,1,Periyaneelavanai,පෙරියනීලවන්නි,பெரியநீலாவணை, NULL, NULL, NULL,32316,7.451606,81.814238
32,1,Polwaga Janapadaya,පොල්වග ජනපදය,போல்வக ஜனபதய, NULL, NULL, NULL,32032,7.243447,81.5569003
33,1,Pottuvil,පොතුවිල්,பொத்துவில், NULL, NULL, NULL,32500,6.8752706,81.8306334
34,1,Sainthamaruthu,සායින්දමරුදු,சாய்ந்தமருது, NULL, NULL, NULL,32280,7.3930492,81.8360977
35,1,Samanthurai,සමන්තුරේ,சம்மாந்துறை, NULL, NULL, NULL,32200,7.3574841,81.7951054
36,1,Serankada,සේරන්කද,சேரன்காடா, NULL, NULL, NULL,32101,7.4567753,81.2787242
37,1,Tempitiya,ටැම්පිටිය,தெம்பிட்டிய, NULL, NULL, NULL,32072,7.6228935,81.3729372
38,1,Thambiluvil,තම්බිලුවිල්,தம்பிலுவில், NULL, NULL, NULL,32415,7.1285122,81.8486164
39,1,Tirukovil,තිරුකෝවිල,திருக்கோவில், NULL, NULL, NULL,32420,7.1153122,81.8524882
40,1,Uhana,උහන,உஹன, NULL, NULL, NULL,32060,7.363036,81.635277
41,1,Wadinagala,වඩිනාගල,வடினாகல, NULL, NULL, NULL,32039,7.1263147,81.5733528
42,1,Wanagamuwa,වනගමුව,வணகமுவ, NULL, NULL, NULL,32454,7.3017563,81.6747295
43,2,Angamuwa,අංගමුව,அங்கமுவா, NULL, NULL, NULL,50248,8.1813311,80.2070328
44,2,Anuradhapura,අනුරාධපුරය,அநுராதபுரம், NULL, NULL, NULL,50000,8.3113518,80.4036508
45,2,Awukana,අව්කන,அவுகனா, NULL, NULL, NULL,50169,8.010142,80.5131156
46,2,Bogahawewa,බෝගහවැව,போகஹவெவ, NULL, NULL, NULL,50566,8.325545,80.2488596
47,2,Dematawewa,දෙමටවැව,தெமடவெவ, NULL, NULL, NULL,50356,8.283333,80.583333
48,2,Dimbulagala,දිඹුලාගල,திம்புலாகல, NULL, NULL, NULL,51031,7.8593413,81.1030573
49,2,Dutuwewa,දුටුවැව,டுடுவெவ, NULL, NULL, NULL,50393,8.6279802,80.8654534
50,2,Elayapattuwa,ඇලයාපත්තුව,எலயபத்துவ, NULL, NULL, NULL,50014,8.3553447,80.3964751
51,2,Ellewewa,ඇල්ලේවැව,எல்லேவெவ, NULL, NULL, NULL,51034,7.780777,81.0782253
52,2,Eppawala,එප්පාවල,எப்பாவெல, NULL, NULL, NULL,50260,8.144095,80.4118721
53,2,Etawatunuwewa,ඇතාවැටුනවැව,எடவதுனுவெவ, NULL, NULL, NULL,50584,8.3113518,80.4036508
54,2,Etaweeragollewa,ඇතාවීරගොලෑව,எடவீரகொல்லேவ, NULL, NULL, NULL,50518,8.6146048,80.5382889
55,2,Galapitagala,ගලපිටගල,கலபிட்டிகல, NULL, NULL, NULL,32066,8.0980899,80.6826254
56,2,Galenbindunuwewa,ගලෙන්බිඳුනුවැව,கலன்பிந்துனுவெவை, NULL, NULL, NULL,50390,8.2921338,80.7172837
57,2,Galkadawala,ගල්කඩවල,கல்கடவல, NULL, NULL, NULL,50006,8.2594462,80.144254
58,2,Galkiriyagama,ගල්කිරියාගම,கல்கிரியாகம, NULL, NULL, NULL,50120,7.9263493,80.5718772
59,2,Galkulama,ගල්කුලම,கல்குலமா, NULL, NULL, NULL,50064,8.3061295,80.4503723
60,2,Galnewa,ගල්නෑව,கல்னேவை, NULL, NULL, NULL,50170,8.0369211,80.4725346
61,2,Gambirigaswewa,ගම්බිරිගස්වැව,கம்பீரிகஸ்வெவ, NULL, NULL, NULL,50057,8.4807571,80.3936994
62,2,Ganewalpola,ගනේවල්පොල,கணேவல்பொல, NULL, NULL, NULL,50142,8.0876104,80.6279175
63,2,Gemunupura,ගැමුණුපුර,கெமுனுபுர, NULL, NULL, NULL,50224,8.1965729,80.1679758
64,2,Getalawa,ගෙතලාව,கெட்டலாவா, NULL, NULL, NULL,50392,8.318262,80.7740608
65,2,Gnanikulama,ඝාණිකුළම,ஞானிகுலம, NULL, NULL, NULL,50036,8.2990166,80.4368245
66,2,Gonahaddenawa,ගෝනහද්දෙනෑව,கோனஹத்தேனாவ, NULL, NULL, NULL,50554,8.3113518,80.4036508
67,2,Habarana,හබරන,ஹபரணை, NULL, NULL, NULL,50150,8.0322147,80.7519272
68,2,Halmillawa Dambulla,හල්මිලෑව දඹුල්ල,ஹல்மில்லாவ தம்புள்ளை, NULL, NULL, NULL,50124,8.1718555,80.7534207
69,2,Halmillawetiya,හල්මිල්ලවැටිය,ஹல்மில்லவெட்டிய, NULL, NULL, NULL,50552,8.7319778,80.6659842
70,2,Hidogama,හිද්දෝගම,ஹிடோகாமா, NULL, NULL, NULL,50044,8.2619434,80.413178
71,2,Horawpatana,හොරොව්පතාන,ஹோரவ்பதானா, NULL, NULL, NULL,50350,8.5569763,80.8312911
72,2,Horiwila,හොරිවිල,ஹோரிவில, NULL, NULL, NULL,50222,7.866667,81.083333
73,2,Hurigaswewa,හුරිගස්වැව,ஹுரிகஸ்வெவ, NULL, NULL, NULL,50176,8.0948635,80.3700407
74,2,Hurulunikawewa,හුරුලුනිකවැව,ஹுருலுனிகாவெவ, NULL, NULL, NULL,50394,8.2708614,80.7591814
75,2,Ihala Puliyankulama,ඉහල පුලියන්කුලම,இஹல புளியங்குளம, NULL, NULL, NULL,61316,8.1520238,80.5632884
76,2,Kagama,කගම,ககம, NULL, NULL, NULL,50282,8.0422633,80.5072321
77,2,Kahatagasdigiliya,කහටගස්දිගිලිය,ககட்டகஸ்திகிலியை, NULL, NULL, NULL,50320,8.425981,80.687253
78,2,Kahatagollewa,කහටගොල්ලෑව,கஹடகொல்லேவ, NULL, NULL, NULL,50562,8.7352357,80.7990185
79,2,Kalakarambewa,කලකරඹෑව,கலகரம்பேவா, NULL, NULL, NULL,50288,8.3113518,80.4036508
80,2,Kalaoya,කලාඔය,கலா ஓய, NULL, NULL, NULL,50226,8.2100191,80.1075439
81,2,Kalawedi Ulpotha,කලාවැදි උල්පොත,கலாவெடி உல்பொத, NULL, NULL, NULL,50556,7.906691,80.375305
82,2,Kallanchiya,කලංචිය,கல்லஞ்சியா, NULL, NULL, NULL,50454,8.4634119,80.5716199
83,2,Kalpitiya,කල්පිටිය,கல்பிட்டி, NULL, NULL, NULL,61360,8.3227405,80.4086119
84,2,Kalukele Badanagala,කළුකැලේ බදනාගල,களுகேலே படனகல, NULL, NULL, NULL,51037,7.7830591,81.058906
85,2,Kapugallawa,කපුගල්ලව,கபுகல்லாவ, NULL, NULL, NULL,50370,8.3113518,80.4036508
86,2,Karagahawewa,කරගහවැව,கரகஹவெவ, NULL, NULL, NULL,50232,8.3369264,80.4154586
87,2,Kashyapapura,කාශ්‍යපපුර,காஷ்யபபுரா, NULL, NULL, NULL,51032,8.3113518,80.4036508
88,2,Kebithigollewa,කැබිතිගොල්ලෑව,கெப்பிட்டிக்கொல்லாவை, NULL, NULL, NULL,50500,8.6411229,80.6696999
89,2,Kekirawa,කැකිරාව,கெக்கிராவ, NULL, NULL, NULL,50100,8.042103,80.593833
90,2,Kendewa,කේන්දෑව,கெண்டேவா, NULL, NULL, NULL,50452,8.4910127,80.6042024
91,2,Kiralogama,කිරළෝගම,கிரலோகம, NULL, NULL, NULL,50259,8.1906287,80.3686488
92,2,Kirigalwewa,කිරිගල්වැව,கிரிகல்வெவ, NULL, NULL, NULL,50511,8.536327,80.5577336
93,2,Kirimundalama,කිරිමුන්ඩලම,கிரிமுண்டலம, NULL, NULL, NULL,61362,8.3113518,80.4036508
94,2,Kitulhitiyawa,කිතුල්හිටියාව,கிதுல்ஹிட்டியாவ, NULL, NULL, NULL,50132,8.3113518,80.4036508
95,2,Kurundankulama,කුරුන්දන්කුලම,குருந்தன்குளம், NULL, NULL, NULL,50062,8.3548567,80.4521216
96,2,Labunoruwa,ලබුනෝරුව,லாபுனோருவா, NULL, NULL, NULL,50088,8.1649851,80.5979973
97,2,Ihalagama,ඉහලගම,இஹலகம, NULL, NULL, NULL,50304,8.3318305,80.4029017
98,2,Ipologama,ඉපොලොගම,இப்பலோகம, NULL, NULL, NULL,50280,8.065027,80.5355107
99,2,Madatugama,මාදතුගම,மடடுகம, NULL, NULL, NULL,50130,7.9458576,80.6271415
100,2,Maha Elagamuwa,මහ ඇලගමුව,மஹா எலகமுவா, NULL, NULL, NULL,50126,7.9914613,80.6188156
101,2,Mahabulankulama,මහබුලංකුලම,மஹாபுலன்குளம, NULL, NULL, NULL,50196,8.3448106,80.3972391
102,2,Mahailluppallama,මහඉලුප්පල්ලම,மகைல்லுப்பல்லம, NULL, NULL, NULL,50270,8.1037364,80.4604643
103,2,Mahakanadarawa,මහකනදරාව,மகாகனதரவ, NULL, NULL, NULL,50306,8.3500293,80.3963687
104,2,Mahapothana,මහපොතාන,மஹாபோதனா, NULL, NULL, NULL,50327,8.3878743,80.7612064
105,2,Mahasenpura,මහසෙන්පුර,மகாசென்புரா, NULL, NULL, NULL,50574,8.8618261,80.8488498
106,2,Mahawilachchiya,මහවිලච්චිය,மஹாவிலச்சியா, NULL, NULL, NULL,50022,8.4707551,80.2098219
107,2,Mailagaswewa,මයිලගස්වැව,மைலகஸ்வெவ, NULL, NULL, NULL,50384,8.2818529,80.6826254
108,2,Malwanagama,මල්වනගම,மல்வானகம, NULL, NULL, NULL,50236,8.3113518,80.4036508
109,2,Maneruwa,මනේරුව,மானேருவா, NULL, NULL, NULL,50182,7.9021403,80.4799273
110,2,Maradankadawala,මරදන්කඩවල,மரதன்கடவல, NULL, NULL, NULL,50080,8.1168652,80.5605111
111,2,Maradankalla,මරදන්කල්ල,மரதன்கல்ல, NULL, NULL, NULL,50308,8.1168652,80.5605111
112,2,Medawachchiya,මැදවච්චිය,மதவாச்சி, NULL, NULL, NULL,50500,8.5374813,80.4909806
113,2,Megodawewa,මීගොඩවැව,மெகொடவெவ, NULL, NULL, NULL,50334,8.2157061,80.7023799
114,2,Mihintale,මිහින්තලේ,மிஹிந்தலை, NULL, NULL, NULL,50300,8.3534232,80.5049445
115,2,Morakewa,මොරකෑව,மொரகேவா, NULL, NULL, NULL,50349,8.5092277,80.785171
116,2,Mulkiriyawa,මුල්කිරියාව,முல்கிரியாவா, NULL, NULL, NULL,50324,8.3113518,80.4036508
117,2,Muriyakadawala,මුරියකඩවල,முறியகடவல, NULL, NULL, NULL,50344,8.1446453,80.5884156
118,5,Colombo 15,කොළඹ 15,கொழும்பு 15, 'Modara', 'මෝදර', 'முகத்துவாரம்',1500,6.9654765,79.8708395
119,2,Nachchaduwa,නච්චදූව,நாச்சதுவ, NULL, NULL, NULL,50046,8.2554964,80.4827074
120,2,Namalpura,නාමල්පුර,நாமல்புர, NULL, NULL, NULL,50339,8.143962,80.747319
121,2,Negampaha,නෑගම්පහ,நெகம்பஹா, NULL, NULL, NULL,50180,7.9578559,80.5112238
122,2,Nochchiyagama,නොච්චියාගම,நொச்சியாகம, NULL, NULL, NULL,50200,8.2925501,80.2265545
123,2,Nuwaragala,නුවරගල,நுவரகல, NULL, NULL, NULL,51039,7.7926466,81.0036821
124,2,Padavi Maithripura,පදවි මෛත්‍රීපුර,பதவிமைத்ரிபுர, NULL, NULL, NULL,50572,8.3448106,80.3972391
125,2,Padavi Parakramapura,පදවි පරාක්‍රමපුර,பதவிபராக்ரமபுர, NULL, NULL, NULL,50582,8.9034422,80.7757984
126,2,Padavi Sripura,පදවි ශ්‍රීපුර,பதவி சிரபுர, NULL, NULL, NULL,50587,8.919506,80.8087103
127,2,Padavi Sritissapura,පදවි ශ්‍රීතිස්සපුර,பதவி ஸ்ரீதிஸ்ஸபுர, NULL, NULL, NULL,50588,8.3113518,80.4036508
128,2,Padaviya,පදවිය,பதவிய, NULL, NULL, NULL,50570,8.8340998,80.7607389
129,2,Padikaramaduwa,පඩිකරමඩුව,படிகாரமடுவ, NULL, NULL, NULL,50338,8.2358572,80.7473475
130,2,Pahala Halmillewa,පහල හල්මිල්ලෑව,பஹல ஹல்மில்லேவா, NULL, NULL, NULL,50206,8.3046182,80.6179952
131,2,Pahala Maragahawe,පහල මරගහවෙ,பஹல மரகஹவே, NULL, NULL, NULL,50220,8.2428601,80.1531951
132,2,Pahalagama,පහලගම,பஹலகம, NULL, NULL, NULL,50244,8.1858538,80.2823063
133,2,Palugaswewa,පලුගස්වැව,பலுகஸ்வெவ, NULL, NULL, NULL,50144,8.0604407,80.6881718
134,2,Pandukabayapura,පන්ඩුකාබයපුර,பாண்டுகபயபுர, NULL, NULL, NULL,50448,8.3113518,80.4036508
135,2,Pandulagama,පන්ඩුලගම,பந்துலகம, NULL, NULL, NULL,50029,8.327516,80.3611091
136,2,Parakumpura,පරාක්‍රමපුර,பரகும்புரா, NULL, NULL, NULL,50326,8.3113518,80.4036508
137,2,Parangiyawadiya,පරංගියාවාඩිය,பரங்கியவாடியா, NULL, NULL, NULL,50354,8.487985,80.9207737
138,2,Parasangahawewa,පරසන්ගහවැව,பரசங்கஹவெவ, NULL, NULL, NULL,50055,8.3553447,80.3964751
139,2,Pelatiyawa,පැලටියාව,பெலட்டியவா, NULL, NULL, NULL,51033,7.81604,81.0920218
140,2,Pemaduwa,පෙමදූව,பேமதுவ, NULL, NULL, NULL,50020,8.4953668,80.191511
141,2,Perimiyankulama,පෙරිමියන්කුලම,பெரிமியங்குளம, NULL, NULL, NULL,50004,8.3553447,80.3964751
142,2,Pihimbiyagolewa,පිහිඹියගොල්ලෑව,பிஹிம்பியகோலேவா, NULL, NULL, NULL,50512,8.3113518,80.4036508
143,2,Pubbogama,පුබ්බෝගම,புப்போகம, NULL, NULL, NULL,50122,7.9280797,80.5968189
144,2,Punewa,පූනෑව,புனேவா, NULL, NULL, NULL,50506,8.6101671,80.4688061
145,2,Rajanganaya,රාජාංගනය,ராஜநாயகை, NULL, NULL, NULL,50246,8.1657207,80.1964443
146,2,Rambewa,රම්බෑව්,ரம்பேவ, NULL, NULL, NULL,50450,8.4401074,80.5049445
147,2,Rampathwila,රම්පත්විල,ரம்பத்வில, NULL, NULL, NULL,50386,8.4025946,80.6354665
148,2,Rathmalgahawewa,රත්මල්ගහවැව,ரத்மல்கஹவெவ, NULL, NULL, NULL,50514,8.5233992,80.6964905
149,2,Saliyapura,සාලියපුර,சாலியபுர, NULL, NULL, NULL,50008,8.4054262,80.4159603
150,2,Seeppukulama,සීප්පුකුලම,சீப்புக்குளம, NULL, NULL, NULL,50380,8.3816127,80.5890579
151,2,Senapura,සේනාපුර,சேனாபுர, NULL, NULL, NULL,50284,8.0006817,81.1582112
152,2,Sivalakulama,සිවලකුලම,சீவலக்குளம, NULL, NULL, NULL,50068,8.2564361,80.6360478
153,2,Siyambalewa,සියඹලෑව,சியம்பலேவா, NULL, NULL, NULL,50184,8.0166861,80.4270885
154,2,Sravasthipura,ස්‍රාවස්තිපුර,ஸ்ரவஸ்திபுரா, NULL, NULL, NULL,50042,8.2988197,80.3770216
155,2,Talawa,තලාව,தலாவ, NULL, NULL, NULL,50230,8.2365189,80.350773
156,2,Tambuttegama,තඹුත්තේගම,தம்புத்தேகம, NULL, NULL, NULL,50240,8.1540015,80.3045967
157,2,Tammennawa,තම්මැන්නාව,தம்மென்னாவா, NULL, NULL, NULL,50104,8.3500293,80.3963687
158,2,Tantirimale,තන්තිරිමලේ,தந்திரிமலை, NULL, NULL, NULL,50016,8.5722802,80.2572225
159,2,Telhiriyawa,තෙල්හිරියාව,தெல்ஹிரியாவ, NULL, NULL, NULL,50242,8.1431293,80.3141349
160,2,Tirappane,තිරප්පනේ,திரப்பனே, NULL, NULL, NULL,50072,8.2133046,80.5271756
161,2,Tittagonewa,තිත්තගෝනෑව,திட்டகோனேவா, NULL, NULL, NULL,50558,8.6964504,80.771321
162,2,Udunuwara Colony,උඩුනුවර කොළණිය,உடுநுவர காலனி, NULL, NULL, NULL,50207,7.2319726,80.5660657
163,2,Upuldeniya,උපුල්දෙනිය,உபுல்தெனிய, NULL, NULL, NULL,50382,8.3138084,80.6604364
164,2,Uttimaduwa,උට්ටිමඩුව,உத்திமடுவ, NULL, NULL, NULL,50067,8.4245753,80.2583325
165,2,Vellamanal,වෙල්ලමනල්,வெல்லமணல், NULL, NULL, NULL,31053,8.3113518,80.4036508
166,2,Viharapalugama,විහාරපාළුගම,விஹாரபாலுகம, NULL, NULL, NULL,50012,8.3630486,80.4054227
167,2,Wahalkada,වාහල්කඩ,வஹல்கடா, NULL, NULL, NULL,50564,8.7224936,80.8350109
168,2,Wahamalgollewa,වහමල්ගොල්ලෑව,வஹமல்கொல்லேவ, NULL, NULL, NULL,50492,8.4807079,80.5021652
169,2,Walagambahuwa,වලගම්බාහුව,வலகம்பஹுவ, NULL, NULL, NULL,50086,8.1558622,80.4966062
170,2,Walahaviddawewa,වලහාවිද්දෑව,வலஹவித்தவெவ, NULL, NULL, NULL,50516,8.4588719,80.8659969
171,2,Welimuwapotana,වැලිමුවපතාන,வெலிமுவபொதன, NULL, NULL, NULL,50358,8.5592976,80.8350109
172,2,Welioya Project,වැලිඔය ව්‍යාපෘතිය,வெலிஓயா திட்டம், NULL, NULL, NULL,50586,8.9640414,80.7879407
173,3,Akkarasiyaya,අක්කරසියය,அக்கரசியாய, NULL, NULL, NULL,90166,6.9934009,81.0549815
174,3,Aluketiyawa,අලුකෙටියාව,அலுகெட்டியவா, NULL, NULL, NULL,90736,7.3,81.116667
175,3,Aluttaramma,අළුත්තරම,அழுதாரம்மா, NULL, NULL, NULL,90722,6.9934009,81.0549815
176,3,Ambadandegama,අඹදන්ඩෙගම,அம்பதண்டேகம, NULL, NULL, NULL,90108,6.8190052,81.0561458
177,3,Ambagasdowa,අඹගස්දූව,அம்பகஸ்டோவா, NULL, NULL, NULL,90300,6.928071,80.8965758
178,3,Arawa,අරාව,அரவா, NULL, NULL, NULL,90017,7.166667,81.083333
179,3,Arawakumbura,අරාවකුඹුර,அரவகும்புரா, NULL, NULL, NULL,90532,7.0873862,81.1995511
180,3,Arawatta,අරාවත්ත,அரவத்தா, NULL, NULL, NULL,90712,7.3433013,81.0371662
181,3,Atakiriya,අටකිරියාව,அடகிரியா, NULL, NULL, NULL,90542,6.9818952,81.076283
182,3,Badulla,බදුල්ල,பதுளை, NULL, NULL, NULL,90000,6.9934009,81.0549815
183,3,Baduluoya,බදුලුඔය,பதுலுஓயா, NULL, NULL, NULL,90019,7.1248255,81.0302639
184,3,Ballaketuwa,බල්ලකැටුව,பதுலு ஓய, NULL, NULL, NULL,90092,6.8622569,81.1002985
185,3,Bambarapana,බඹරපාන,பம்பரபான, NULL, NULL, NULL,90322,6.9815696,80.9511835
186,3,Bandarawela,බණ්ඩාරවෙල,பண்டாரவளை, NULL, NULL, NULL,90100,6.825878,80.9981576
187,3,Beramada,බෙරමඩ,பெரமடா, NULL, NULL, NULL,90066,6.9212506,79.8477852
188,3,Bibilegama,බිබිලේගම,பிபிலேகம, NULL, NULL, NULL,90502,6.896173,81.1402905
189,3,Boragas,බොරගස්,போரகஸ், NULL, NULL, NULL,90362,6.899901,80.8460822
190,3,Boralanda,බොරලන්ද,பொரலண்டா, NULL, NULL, NULL,90170,6.8279044,80.8945014
191,3,Bowela,බෝවෙල,போவேலா, NULL, NULL, NULL,90302,6.9818952,81.076283
192,3,Central Camp,මධ්‍යම කඳවුර,மத்திய முகாம், NULL, NULL, NULL,32050,6.9934009,81.0549815
193,3,Damanewela,දමනෙවෙල,தமனேவல, NULL, NULL, NULL,32126,6.9934009,81.0549815
194,3,Dambana,දඹාන,தம்பானை, NULL, NULL, NULL,90714,7.4136229,81.1083483
195,3,Dehiattakandiya,දෙහිඅත්තකන්ඩිය,தெகியத்தகண்டிய, NULL, NULL, NULL,32150,7.6712796,81.046484
196,3,Demodara,දෙමෝදර,தெமோதர, NULL, NULL, NULL,90080,6.8992829,81.0581776
197,3,Diganatenna,දිගනතැන්න,திகனதென்ன, NULL, NULL, NULL,90132,6.8558849,80.9652617
198,3,Dikkapitiya,දික්කපිටිය,திக்கபிட்டிய, NULL, NULL, NULL,90214,6.8936862,80.9373623
199,3,Dimbulana,දිඹුලාන,டிம்புலான, NULL, NULL, NULL,90324,7.0152778,80.94
200,3,Divulapelessa,දිවුලපැලැස්ස,திவுலபெலஸ்ஸ, NULL, NULL, NULL,90726,7.5778255,81.0036821
201,3,Diyatalawa,දියතලාව,தியத்தலாவை, NULL, NULL, NULL,90150,6.806951,80.9572021
202,3,Dulgolla,දුල්ගොල්ල,துல்கொல்லா, NULL, NULL, NULL,90104,6.8568541,80.8834367
203,3,Ekiriyankumbura,ඇකිරියන්කුඹුර,எகிரியன்கும்புர, NULL, NULL, NULL,91502,7.2988884,81.2408689
204,3,Ella,ඇල්ල,எல்ல, NULL, NULL, NULL,90090,6.8666988,81.046553
205,3,Ettampitiya,ඇට්ටම්පිටිය,எட்டம்பிட்டிய, NULL, NULL, NULL,90140,6.9364506,80.987798
206,3,Galauda,ගලඋඩ,கல உட, NULL, NULL, NULL,90065,6.9934009,81.0549815
207,3,Galporuyaya,ගල්පොරුයාය,கல்போருயாய, NULL, NULL, NULL,90752,7.4285203,81.0368211
208,3,Gawarawela,ගවරවෙල,கவரவெல, NULL, NULL, NULL,90082,6.9028497,81.0713261
209,3,Girandurukotte,ගිරාඳුරුකෝට්ටෙ,கிரந்துருகோட்டே, NULL, NULL, NULL,90750,7.4629169,81.0174917
210,3,Godunna,ගොඩුන්න,கோடுன்னா, NULL, NULL, NULL,90067,7.0668238,80.974884
211,3,Gurutalawa,ගුරුතලාව,குருத்தலாவை, NULL, NULL, NULL,90208,6.843509,80.9000223
212,3,Haldummulla,හල්දුම්මුල්ල,ஹல்துமுல்ல, NULL, NULL, NULL,90180,6.7689228,80.8926681
213,3,Hali Ela,හාලි ඇල,ஆலி-எலை, NULL, NULL, NULL,90060,6.9555254,81.0314384
214,3,Hangunnawa,හඟුන්නෑව,ஹங்குன்னாவ, NULL, NULL, NULL,90224,6.9495073,80.8723705
215,3,Haputale,හපුතලේ,அப்புத்தளை, NULL, NULL, NULL,90160,6.7654136,80.9525655
