city_id,district_id,name_en,name_si,name_ta,sub_name_en,sub_name_si,sub_name_ta,postcode,latitude,longitude
437,6,Poddala,පෝද්දල,போத்தலா, NULL, NULL, NULL,80170,6.1084688,80.223766
438,6,Polgampola,පොල්ගම්පොල,பொல்கம்பொல, NULL, NULL, NULL,12136,6.4651893,80.1961205
439,6,Porawagama,පොරවගම,பொறவகம, NULL, NULL, NULL,80408,6.2872078,80.2249426
440,6,Rantotuwila,රන්තොටුවිල,ரந்தொடுவில, NULL, NULL, NULL,80354,6.0535185,80.2209773
441,6,Talagampola,තලගම්පොල,தலகம்பொல, NULL, NULL, NULL,80058,6.0870628,80.3035418
442,6,Talgaspe,තල්ගස්පෙ,டல்காஸ்பே, NULL, NULL, NULL,80406,6.0542348,80.2244631
443,6,Talpe,තල්පෙ,தல்பே, NULL, NULL, NULL,80615,6.0009954,80.2781262
444,6,Tawalama,තවලම,தவலம, NULL, NULL, NULL,80148,6.3347269,80.3421984
445,6,Tiranagama,තිරණගම,திரணகம, NULL, NULL, NULL,80244,6.1285798,80.1112155
446,6,Udalamatta,උඩලමත්ත,உடலமட்டா, NULL, NULL, NULL,80108,6.1835935,80.2982507
447,6,Udugama,උඩුගම,உடுகம, NULL, NULL, NULL,80070,6.2179047,80.3380213
448,6,Uluvitike,උලුවිටිකේ,உலுவிதிகே, NULL, NULL, NULL,80168,6.0833989,80.2112164
449,6,Unawatuna,උණවටුන,உணவட்டுன, NULL, NULL, NULL,80600,6.0174469,80.2488596
450,6,Unawitiya,උනවිටිය,உனவிட்டிய, NULL, NULL, NULL,80214,6.0535185,80.2209773
451,6,Uragaha,ඌරගහ,உரகஹா, NULL, NULL, NULL,80352,6.349044,80.0978637
452,6,Uragasmanhandiya,ඌරගස්මන්හන්දිය,ஊரகஸ்மண்டிய, NULL, NULL, NULL,80350,6.349044,80.0978637
453,6,Wakwella,වක්වැල්ල,வக்வெள்ள, NULL, NULL, NULL,80042,6.0921684,80.1902963
454,6,Walahanduwa,වලහන්දූව,வலஹந்துவா, NULL, NULL, NULL,80046,6.0515591,80.2572225
455,6,Wanchawela,වංචාවල,வஞ்சாவெல, NULL, NULL, NULL,80120,6.0357108,80.2685967
456,6,Wanduramba,වඳුරඹ,வந்துரம்ப, NULL, NULL, NULL,80100,6.1324713,80.2488596
457,6,Warukandeniya,වාරුකන්දෙනිය,வாருகந்தெனிய, NULL, NULL, NULL,80084,6.3661038,80.4048306
458,6,Watugedara,වටුගෙදර,வடுகெதர, NULL, NULL, NULL,80340,6.2612121,80.0604774
459,6,Weihena,වැයිහේන,வெய்ஹேனா, NULL, NULL, NULL,80216,6.3077798,80.2349196
460,6,Welikanda,වැලිකන්ද,வெலிகந்ந, NULL, NULL, NULL,51070,7.9459654,81.2491298
461,6,Wilanagama,විලනගම,விலானகம, NULL, NULL, NULL,20142,6.0041796,80.4138113
462,6,Yakkalamulla,යක්කලමුල්ල,யக்கலமுல்ல, NULL, NULL, NULL,80150,6.1013495,80.3591002
463,6,Yatalamatta,යටලමත්ත,யாதலமட்டா, NULL, NULL, NULL,80107,6.1737333,80.2864862
464,7,Akaragama,අකරගම,அகரகம, NULL, NULL, NULL,11536,7.2734803,79.9570411
465,7,Ambagaspitiya,අඹගස්පිටිය,அம்பகஸ்பிட்டிய, NULL, NULL, NULL,11052,7.0844509,80.0653366
466,7,Ambepussa,අඹේපුස්ස,அம்பேபுசா, NULL, NULL, NULL,11212,7.2561036,80.1693285
467,7,Andiambalama,ආඬිඅම්බලම,ஆண்டிஅம்பலமா, NULL, NULL, NULL,11558,7.1788127,79.9068534
468,7,Attanagalla,අත්තනගල්ල,அத்தனகல்ல, NULL, NULL, NULL,11120,7.1137427,80.1355005
469,7,Badalgama,බඩල්ගම,படல்கம, NULL, NULL, NULL,11538,7.2886523,79.9808143
470,7,Banduragoda,බඳුරගොඩ,பாண்டுராகொட, NULL, NULL, NULL,11244,7.2277935,80.0576834
471,7,Batuwatta,බටුවත්ත,படுவத்த, NULL, NULL, NULL,11011,7.062254,79.9412368
472,7,Bemmulla,බෙම්මුල්ල,பெம்முல்லா, NULL, NULL, NULL,11040,7.1131318,80.0271893
473,7,Biyagama IPZ,බියගම IPZ,பியகம IPZ, NULL, NULL, NULL,11672,6.962284,80.0090367
474,7,Bokalagama,බොකලගම,பொகலகம, NULL, NULL, NULL,11216,7.2153207,80.102926
475,7,Bollete (WP),බොල්ලතේ,பொல்லட் (WP), NULL, NULL, NULL,11024,7.0840484,80.0098314
476,7,Bopagama,බෝපගම,போபகம, NULL, NULL, NULL,11134,7.0713069,80.163696
477,7,Buthpitiya,බුත්පිටිය,புத்பிட்டிய, NULL, NULL, NULL,11720,7.0547003,80.0532264
478,7,Dagonna,දාගොන්න,டகோன்ன, NULL, NULL, NULL,11524,7.2100549,79.9164717
479,7,Danowita,දංඕවිට,தனோவிட்ட, NULL, NULL, NULL,11896,7.2208777,80.1679758
480,7,Debahera,දෙබහැර,டெபஹேரா, NULL, NULL, NULL,11889,7.1579747,80.1498362
481,7,Dekatana,දෙකටන,தெகடன, NULL, NULL, NULL,11690,6.9702324,80.0424192
482,7,Delgoda,දෙල්ගොඩ,தெல்கொட, NULL, NULL, NULL,11700,6.9892885,80.0143766
483,7,Delwagura,දෙල්වගුර,தெல்வகுரா, NULL, NULL, NULL,11228,7.2652482,80.005979
484,7,Demalagama,දෙමළගම,தெமலகம, NULL, NULL, NULL,11692,6.9912763,80.0520952
485,7,Demanhandiya,දෙමන්හන්දිය,தேமன்ஹந்தியா, NULL, NULL, NULL,11270,7.2243879,79.8845135
486,7,Dewalapola,දේවාලපොල,தெவலபொல, NULL, NULL, NULL,11102,7.1612037,79.9919995
487,7,Divulapitiya,දිවුලපිටිය,திவுலபிட்டிய, NULL, NULL, NULL,11250,7.2303143,80.016474
488,7,Divuldeniya,දිවුල්දෙණිය,திவுல்தெனிய, NULL, NULL, NULL,11208,7.2807254,80.0437123
489,7,Dompe,දොම්පෙ,தொம்பே, NULL, NULL, NULL,11680,6.9403947,80.0771962
490,7,Dunagaha,දුනගහ,துணகஹா, NULL, NULL, NULL,11264,7.2220533,79.9780178
491,7,Ekala,ඒකල,எக்கலை, NULL, NULL, NULL,11380,7.1022913,79.9094751
492,7,Ellakkala,ඇල්ලක්කල,எல்லக்கல, NULL, NULL, NULL,11116,7.141665,80.1330885
493,7,Essella,එස්සැල්ල,எஸ்செல்லா, NULL, NULL, NULL,11108,7.1765135,80.0254696
494,7,Galedanda,ගලේදණ්ඩ,கலேடாண்டா, NULL, NULL, NULL,90206,6.9648642,79.9318623
495,7,Gampaha,ගම්පහ,கம்பஹா, NULL, NULL, NULL,11000,7.0840484,80.0098314
496,7,Ganemulla,ගණේමුල්ල,கணேமுல்லை, NULL, NULL, NULL,11020,7.082719,79.9482548
497,7,Giriulla,ගිරිවුල්ල,கிரியுள்ளை, NULL, NULL, NULL,60140,7.3486749,80.1380195
498,7,Gonawala,ගෝනවල,கோனவளை, NULL, NULL, NULL,11630,6.9541703,79.9366187
499,7,Halpe,හල්පෙ,ஹல்பே, NULL, NULL, NULL,70145,7.2622107,79.9290642
500,7,Hapugastenna,හපුගස්තැන්න,ஹப்புகஸ்தென்ன, NULL, NULL, NULL,70164,6.740544,80.1888173
501,7,Heiyanthuduwa,හෙයියන්තුඩුව,ஹெய்யந்துடுவ, NULL, NULL, NULL,11618,6.9718768,79.9737642
502,7,Hinatiyana Madawala,හීනටියන මඩවල,ஹினாட்டியான மடவல, NULL, NULL, NULL,11568,7.1501572,79.9122738
503,7,Hiswella,හිස්වැල්ල,ஹிஸ்வெல்லா, NULL, NULL, NULL,11734,7.0201574,80.1637901
504,7,Horampella,හොරම්පැල්ල,ஹோரம்பெல்ல, NULL, NULL, NULL,11564,7.1702315,79.9794161
505,7,Hunumulla,හුණුමුල්ල,ஹுனுமுல்லா, NULL, NULL, NULL,11262,7.233651,79.989309
506,7,Hunupola,හුණුපොල,ஹுனுபொல, NULL, NULL, NULL,60582,7.6142188,80.3895248
507,7,Ihala Madampella,ඉහල මදම්පෙල්ල,இஹல மடம்பெல்லா, NULL, NULL, NULL,11265,7.2489535,79.9537193
508,7,Imbulgoda,ඉඹුල්ගොඩ,இம்புல்கொட, NULL, NULL, NULL,11856,7.087046,80.0175104
509,7,Ja-Ela,ජා-ඇල,ஜா-எல, NULL, NULL, NULL,11350,7.0857596,79.9254445
510,7,Kadawatha,කඩවත,கடவதை, NULL, NULL, NULL,11850,7.0046719,79.9542002
511,7,Kahatowita,කහටෝවිට,கஹடோவிட்ட, NULL, NULL, NULL,11144,7.0974551,80.112239
512,7,Kalagedihena,කලගෙඩිහේන,கலகெடிஹேன, NULL, NULL, NULL,11875,7.1201435,80.0590804
513,7,Kaleliya,කල්එළිය,கலேலியா, NULL, NULL, NULL,11160,7.1970231,80.1107531
514,7,Kandana,කඳාන,கந்தான, NULL, NULL, NULL,11320,7.0477897,79.8970348
515,7,Katana,කටාන,கட்டான, NULL, NULL, NULL,11534,7.2480284,79.8993665
516,7,Katudeniya,කටුදෙණිය,கட்டுதெனிய, NULL, NULL, NULL,21016,7.438319,80.6415452
517,7,Katunayake,කටුනායක,கட்டுநாயக்க, NULL, NULL, NULL,11450,7.1724849,79.8853484
518,7,Katunayake Air Force Camp,කටුනායක ගුවන් හමුදා කඳවුර,கட்டுநாயக்க விமானப் படை முகாம், NULL, NULL, NULL,11440,7.1828293,79.867739
519,7,Katunayake(FTZ),කටුනායක නිදහස් වෙළඳ කලාපය,கட்டுநாயக்க FTZ, NULL, NULL, NULL,11420,7.1736603,79.8868861
520,7,Katuwellegama,කටුවෙල්ලගම,கட்டுவெல்லேகம, NULL, NULL, NULL,11526,7.1997133,79.9497668
521,7,Kelaniya,කැළණිය,களனி, NULL, NULL, NULL,11600,6.9782137,79.9115522
522,7,Kimbulapitiya,කිඹුලාපිටිය,கிம்புலாபிட்டிய, NULL, NULL, NULL,11522,7.2042407,79.8940806
523,7,Kirindiwela,කිරිඳිවෙල,கிரிந்திவெல, NULL, NULL, NULL,11730,7.0411825,80.1289324
524,7,Kitalawalana,කිතලවලාන,கிடலவலன, NULL, NULL, NULL,11206,7.2909333,80.1142434
525,7,Kochchikade,කොච්චිකඩේ,கொச்சிக்கடை, NULL, NULL, NULL,11540,7.2657063,79.8591235
526,7,Kotadeniyawa,කොටදෙණියාව,கொட்டதெனியாவ, NULL, NULL, NULL,11232,7.2838813,80.066065
527,7,Kotugoda,කොටුගොඩ,கொட்டுகொட, NULL, NULL, NULL,11390,7.123191,79.9241673
528,7,Kumbaloluwa,කුඹල්ඔළුව,கும்பலோலுவ, NULL, NULL, NULL,11105,7.1771057,80.1121493
529,7,Loluwagoda,ලොළුවගොඩ,லொலுவாகொட, NULL, NULL, NULL,11204,7.2921006,80.135035
530,7,Mabodale,මබෝදලේ,மபோடலே, NULL, NULL, NULL,11114,7.2024369,80.0187213
531,7,Madelgamuwa,මැදැල්ගමුව,மடல்கமுவ, NULL, NULL, NULL,11033,7.1084613,79.9598696
532,7,Makewita,මාකවිට,மகேவிதா, NULL, NULL, NULL,11358,7.10095,79.9633262
533,7,Makola,මාකොල,மாகொல, NULL, NULL, NULL,11640,6.9718989,79.9466398
534,7,Malwana,මල්වාන,மல்வான, NULL, NULL, NULL,11670,6.9507844,80.0157449
535,7,Mandawala,මන්දාවල,மண்டவாலா, NULL, NULL, NULL,11061,7.0001178,80.0939978
536,7,Marandagahamula,මරඳගහමුල,மரந்தகஹமுல, NULL, NULL, NULL,11260,7.2289814,79.9906015
537,7,Mellawagedara,මෙල්ලවගෙදර,மெல்லவகெதர, NULL, NULL, NULL,11234,7.2856809,80.026944
538,7,Minuwangoda,මිනුවන්ගොඩ,மினுவன்கொட, NULL, NULL, NULL,11550,7.1842076,79.9500477
539,7,Mirigama,මීරිගම,மீரிகம, NULL, NULL, NULL,11200,7.2271109,80.1567664
540,7,Miriswatta,මිරිස්වත්ත,மிரிஸ்வத்த, NULL, NULL, NULL,80508,7.0727394,80.0157633
541,7,Mithirigala,මිතිරිගල,மிதிரிகல, NULL, NULL, NULL,11742,6.9962236,80.1609995
542,7,Muddaragama,මුද්දරගම,முத்தாரகம, NULL, NULL, NULL,11112,7.2085995,80.0550033
543,7,Mudungoda,මුදුන්ගොඩ,முடுங்கோடா, NULL, NULL, NULL,11056,7.0666922,80.012269
544,7,Mulleriyawa New Town,මුල්ලේරියාව නව නගරය,முல்லேரியா புதிய நகரம், NULL, NULL, NULL,10620,7.0840484,80.0098314
545,7,Naranwala,නාරංවල,நாரங்வல, NULL, NULL, NULL,11063,7.0118957,80.0241489
546,7,Nawana,නාවන,நவானா, NULL, NULL, NULL,11222,7.0840484,80.0098314
547,7,Nedungamuwa,නැදුන්ගමුව,நெதுன்கமுவ, NULL, NULL, NULL,11066,7.0489741,80.0213538
548,7,Negombo,මීගමුව,நீர்கொழும்பு, NULL, NULL, NULL,11500,7.1955474,79.8573384
549,7,Nikadalupotha,නිකදළුපොත,நிகடலுபோத, NULL, NULL, NULL,60580,7.6540965,80.3756081
550,7,Nikahetikanda,නිකහැටිකන්ද,நிகஹெதிகந்த, NULL, NULL, NULL,11128,7.0988024,80.1791368
551,7,Nittambuwa,නිට්ටඹුව,நிட்டம்புவ, NULL, NULL, NULL,11880,7.1423639,80.1037721
552,7,Niwandama,නිවන්දම,நிவந்தமா, NULL, NULL, NULL,11354,7.0734533,79.9277763
553,7,Opatha,ඕපාත,ஓப்பாத்த, NULL, NULL, NULL,80142,7.1320576,79.9263427
554,7,Pamunugama,පමුණුගම,பமுனுகம, NULL, NULL, NULL,11370,7.0864986,79.8548823
555,7,Pamunuwatta,පමුණුවත්ත,பமுனுவத்த, NULL, NULL, NULL,11214,7.2163123,80.1414627
556,7,Panawala,පනාවල,பனாவல, NULL, NULL, NULL,70612,7.1674068,80.0939978
557,7,Pasyala,පස්යාල,பஸ்யால, NULL, NULL, NULL,11890,7.1667103,80.1233175
558,7,Peliyagoda,පෑලියගොඩ,பேலியகொட, NULL, NULL, NULL,11830,6.9584915,79.9055819
559,7,Pepiliyawala,පැපිලියාවල,பெபிலியவல, NULL, NULL, NULL,11741,7.00218,80.128901
560,7,Pethiyagoda,පෙතියාගොඩ,பெத்தியகொட, NULL, NULL, NULL,11043,7.1380617,79.9951044
561,7,Polpithimukulana,පොල්පිතිමූකලාන,பொல்பிதிமுகுலான, NULL, NULL, NULL,11324,7.0840484,80.0098314
562,7,Puwakpitiya,පුවක්පිටිය,புவக்பிட்டிய, NULL, NULL, NULL,10712,7.0380187,80.0674619
563,7,Radawadunna,රදාවඩුන්න,ராதவடுன்னா, NULL, NULL, NULL,11892,7.1843873,80.1414627
564,7,Radawana,රදාවාන,ராதாவானா, NULL, NULL, NULL,11725,7.0319495,80.0939978
565,7,Raddolugama,රද්දොළුගම,இரத்தொளுகம, NULL, NULL, NULL,11400,7.1406334,79.9013603
566,7,Ragama,රාගම,ராகம, NULL, NULL, NULL,11010,7.0231768,79.9077723
567,7,Ruggahawila,රුග්ගහවිල,ருக்கஹாவில, NULL, NULL, NULL,11142,7.1100379,80.1142434
568,7,Seeduwa,සීදුව,சீதுவை, NULL, NULL, NULL,11410,7.1406784,79.8869732
569,7,Siyambalape,සියඹලාපේ,சியம்பலாபே, NULL, NULL, NULL,11607,6.9674112,79.9892034
570,7,Talahena,තලාහේන,தலஹேன, NULL, NULL, NULL,11504,7.0840484,80.0098314
571,7,Thambagalla,තඹගල්ල,தம்பகல்ல, NULL, NULL, NULL,60584,7.0840484,80.0098314
572,7,Thimbirigaskatuwa,තිඹිරිගස්කටුව,திம்பிரிகஸ்கடுவ, NULL, NULL, NULL,11532,7.1354242,79.8885102
573,7,Tittapattara,තිත්තපත්තර,திட்டபட்டரா, NULL, NULL, NULL,10664,6.9135615,80.0597213
574,7,Udathuthiripitiya,උඩතුත්තිරිපිටිය,உடதுதிரிபிட்டிய, NULL, NULL, NULL,11054,7.0840484,80.0098314
575,7,Udugampola,උඩුගම්පල,உடுகம்பளை, NULL, NULL, NULL,11030,7.1263574,79.9780178
576,7,Uggalboda,උග්ගල්බොඩ,உக்கல்போடா, NULL, NULL, NULL,11034,7.1324802,79.9542438
577,7,Urapola,ඌරාපොල,ஊரபோல, NULL, NULL, NULL,11126,7.0980424,80.1449906
578,7,Uswetakeiyawa,උස්වැටකෙයියාව,உஸ்வெட்டிகேயவா, NULL, NULL, NULL,11328,7.0389911,79.8660836
579,7,Veyangoda,වෙයන්ගොඩ,வேயங்கொடை, NULL, NULL, NULL,11100,7.1662139,80.0558695
580,7,Walgammulla,වල්ගම්මුල්ල,வலகம்முல்ல, NULL, NULL, NULL,11146,7.0709392,80.1177335
581,7,Walpita,වල්පිට,வல்பிட, NULL, NULL, NULL,11226,7.2612667,80.045913
582,7,Walpola (WP),වල්පොල,வல்பொல (WP), NULL, NULL, NULL,11012,7.1943487,79.9276651
583,7,Wathurugama,වතුරුගම,வத்துருகம, NULL, NULL, NULL,11724,7.0546548,80.1009796
584,7,Watinapaha,වටිනාපහ,வட்டினபஹா, NULL, NULL, NULL,11104,7.1853118,80.0003875
585,7,Wattala,වත්තල,வத்தளை, NULL, NULL, NULL,11104,6.9906677,79.8931709
586,7,Weboda,වෙිබොඩ,வெபோடா, NULL, NULL, NULL,11858,7.0251175,79.9913005
587,7,Wegowwa,වෑගොව්ව,வேகவ்வா, NULL, NULL, NULL,11562,7.1716032,79.9746299
588,7,Weweldeniya,වේවැල්දෙණිය,வெவெல்தெனிய, NULL, NULL, NULL,11894,7.1979285,80.1526271
589,7,Yakkala,යක්කල,யக்கல, NULL, NULL, NULL,11870,7.0864153,80.0335107
590,7,Yatiyana,යටියන,யதியான, NULL, NULL, NULL,11566,7.1867708,79.9260548
591,8,Ambalantota,අම්බලන්තොට,அம்பலாந்தோட்டை, NULL, NULL, NULL,82100,6.1225999,81.0237594
592,8,Angunakolapelessa,අඟුණකොළපැලැස්ස,அங்குனுகொலபெலஸ்ஸ, NULL, NULL, NULL,82220,6.1655689,80.9031172
593,8,Angunakolawewa,අඟුණකොලවැව,அங்குனகொலவெவ, NULL, NULL, NULL,91302,6.4115488,81.0859235
594,8,Bandagiriya Colony,බන්ඩගිරිය කොලොනි,பண்டகிரிய காலனி, NULL, NULL, NULL,82005,6.2408604,81.1448479
595,8,Barawakumbuka,බරවකුඹුර,பரவகும்புகா, NULL, NULL, NULL,82110,6.2257854,80.9290685
596,8,Beliatta,බෙලිඅත්ත,பெலியத்த, NULL, NULL, NULL,82400,6.0481573,80.7339144
597,8,Beragama,බෙරගම,பெரகம, NULL, NULL, NULL,82102,6.1421255,81.0318169
598,8,Beralihela,බෙරලිහෙල,பெரலிஹெல, NULL, NULL, NULL,82618,6.321587,81.2981673
599,8,Bundala,බූන්දල,பண்டாலா, NULL, NULL, NULL,82002,6.1942487,81.1873141
600,8,Ellagala,ඇල්ලගල,எல்லகல, NULL, NULL, NULL,82619,6.333333,81.25
601,8,Gangulandeniya,ගඟුලදෙණිය,கங்குலந்தெனிய, NULL, NULL, NULL,82586,6.2956299,80.7186697
602,8,Getamanna,ගැටමාන්න,கெட்டமன்னா, NULL, NULL, NULL,82420,6.0395499,80.6895583
603,8,Goda Koggalla,ගොඩ කොග්ගල්ල,கொட கொக்கல்ல, NULL, NULL, NULL,82401,6.183333,81.016667
604,8,Gonagamuwa Uduwila,ගොනාගමුව උඩුවිල,கோனகமுவ உடுவில, NULL, NULL, NULL,82602,6.2472394,81.265649
605,8,Gonnoruwa,ගොන්නොරුව,கொன்னொருவா, NULL, NULL, NULL,82006,6.233333,81.1
606,8,Hakuruwela,හකුරුවෙල,ஹகுருவெல, NULL, NULL, NULL,82248,6.1493333,80.8308587
607,8,Hambantota,හම්බන්තොට,ஹம்பாந்தோட்டை, NULL, NULL, NULL,82000,6.1428829,81.1212308
608,8,Handugala,හඳගුල,ஹண்டுகல, NULL, NULL, NULL,81326,6.1903211,80.6257539
609,8,Hungama,හුංගම,ஹங்காமா, NULL, NULL, NULL,82120,6.115626,80.9290685
610,8,Ihala Beligalla,ඉහල බෙලිගල්ල,இஹல பெலிகல்ல, NULL, NULL, NULL,82412,6.1535816,81.127149
611,8,Iththa Demaliya,ඉත්ත දෙමලිය,இத்தா தெமாலியா, NULL, NULL, NULL,82462,6.1678463,80.7459337
612,8,Julampitiya,ජුලම්පිටිය,ஜுலம்பிட்டிய, NULL, NULL, NULL,82252,6.2355232,80.7354311
613,8,Kahandamodara,කහඳමෝදර,கஹந்தமோதர, NULL, NULL, NULL,82126,6.0698824,80.891511
614,8,Kariyamaditta,කරියමදිත්ත,காரியமடித்தா, NULL, NULL, NULL,82274,6.2552733,80.8128636
615,8,Katuwana,කටුවන,கடுவன, NULL, NULL, NULL,82500,6.2636238,80.6909448
616,8,Kawantissapura,කාවන්තිස්සපුර,கவுந்திஸ்ஸபுர, NULL, NULL, NULL,82622,6.3518712,81.3129795
617,8,Kirama,කිරම,கிரம, NULL, NULL, NULL,82550,6.2066921,80.6618234
618,8,Kirinda,කිරින්ද,கிரிந்த, NULL, NULL, NULL,82614,6.235236,81.3344408
619,8,Lunama,ලුනම,லுனாமா, NULL, NULL, NULL,82108,6.0953167,80.9677658
620,8,Lunugamwehera,ලුණුගම්වෙහෙර,லுணுகம் வெஹர, NULL, NULL, NULL,82634,6.3383515,81.1442093
621,8,Magama,මාගම,மகம, NULL, NULL, NULL,82608,6.2058366,81.30418
622,8,Mahagalwewa,මහගල්වැව,மகாகல்வெவ, NULL, NULL, NULL,82016,6.3854382,81.0395821
623,8,Mamadala,මාමඩල,மாமடல, NULL, NULL, NULL,82109,6.1596539,80.974674
624,8,Medamulana,මැදමුලන,மெதமுலன, NULL, NULL, NULL,82254,6.1810279,80.7685508
625,8,Middeniya,මිද්දෙණිය,மித்தெனிய, NULL, NULL, NULL,82270,6.2513579,80.7641653
626,8,Meegahajandura,මිගහජන්දුරැ,மீகஹஜந்துர, NULL, NULL, NULL,82014,6.1592853,81.1273013
627,8,Modarawana,මොදරවාන,மோதரவன, NULL, NULL, NULL,82416,6.1173609,80.7242136
628,8,Mulkirigala,මුල්කිරිගල,முல்கிரிகல, NULL, NULL, NULL,82242,6.1087918,80.7588541
629,8,Nakulugamuwa,නාකුළුගමුව,நகுலுகமுவ, NULL, NULL, NULL,82300,5.9954309,80.7089671
630,8,Netolpitiya,නෙටොල්පිටිය,நெடோல்பிட்டிய, NULL, NULL, NULL,82135,6.0656506,80.8391628
631,8,Nihiluwa,නිහිලුව,நிஹிலுவா, NULL, NULL, NULL,82414,6.0713577,80.7062933
632,8,Padawkema,පදව්කෙම,படவ்கேமா, NULL, NULL, NULL,82636,6.1428829,81.1212308
633,8,Pahala Andarawewa,පහල අන්දරවැව,பஹல அந்தரவெவ, NULL, NULL, NULL,82008,6.299588,81.0856327
634,8,Rammalawarapitiya,රම්මලවරපිටිය,ரம்மலவரபிட்டிய, NULL, NULL, NULL,82554,6.2219871,80.6368539
635,8,Ranakeliya,රණකෙලිය,ரணகெலிய, NULL, NULL, NULL,82612,6.1428829,81.1212308
636,8,Ranmuduwewa,රන්මුඩුවැව,ரன்முதுவெவ, NULL, NULL, NULL,82018,6.3462942,81.058906
637,8,Ranna,රන්න,ரன்னா, NULL, NULL, NULL,82125,6.0935429,80.8626864
638,8,Ratmalwala,රත්මල්වල,ரத்மல்வல, NULL, NULL, NULL,82276,6.1428829,81.1212308
639,8,Ruhunu Ridiyagama,රුහුණු රිදියගම,ருஹுனு ரிதியகம, NULL, NULL, NULL,82106,6.2468436,80.9824649
640,8,Sooriyawewa Town,සූරියවැව නගරය,சூரியவெவ நகரம், NULL, NULL, NULL,82010,6.3110025,80.9953952
641,8,Tangalla,තංගල්ල,தங்காலை, NULL, NULL, NULL,82200,6.0243383,80.7940726
642,8,Tissamaharama,තිස්සමහාරාම,திஸ்ஸமஹராமை, NULL, NULL, NULL,82600,6.2791538,81.2876691
643,8,Uda Gomadiya,උඩ ගෝමදිය,உட கோமதியா, NULL, NULL, NULL,82504,6.2956159,80.6693375
644,8,Udamattala,උඩමත්තල,உடமத்தல, NULL, NULL, NULL,82638,6.2913906,81.1213571
645,8,Uswewa,උස්වැව,உஸ்வேவா, NULL, NULL, NULL,82278,6.2420622,80.8834367
646,8,Vitharandeniya,විතාරන්දෙණිය,விதாரந்தெனிய, NULL, NULL, NULL,82232,6.0243383,80.7940726
647,8,Walasmulla,වළස්මුල්ල,வலஸ்முல்ல, NULL, NULL, NULL,82450,6.1508888,80.6937177
648,8,Weeraketiya,වීරකැටිය,வீரகெட்டிய, NULL, NULL, NULL,82240,6.1476081,80.7633743
649,8,Weerawila,වීරවිල,வீரவில, NULL, NULL, NULL,82632,6.2421494,81.229209
650,8,Weerawila NewTown,වීරවිල නව නගරය,வீரவில நியூடவுன், NULL, NULL, NULL,82615,6.2421494,81.229209
651,8,Wekandawela,වෑකඳවෙල,வெகந்தவெல, NULL, NULL, NULL,82246,6.1428829,81.1212308
652,8,Weligatta,වැලිගත්ත,வெலிகட்டா, NULL, NULL, NULL,82004,6.2385761,81.2188355
653,8,Yatigala,යටිගල,யடிகல, NULL, NULL, NULL,82418,6.1134196,80.6947365
654,9,Jaffna,යාපනය,யாழ்ப்பாணம், NULL, NULL, NULL,40000,9.669013,80.0269528
655,10,Agalawatta,අගලවත්ත,அகலவத்தை, NULL, NULL, NULL,12200,6.5422794,80.157504
656,10,Alubomulla,අලුබෝමුල්ල,அலுபோமுல்லா, NULL, NULL, NULL,12524,6.7113091,79.9458514
657,10,Anguruwatota,අංගුරුවතොට,அங்குறுவதோட்ட, NULL, NULL, NULL,12320,6.6446971,80.0745954
658,10,Atale,අටලේ,ஒரு கதை, NULL, NULL, NULL,71363,6.45,80.266667
